{
  "schema_version": 1,
  "artifact_kind": "pooleos_native_firmware_golden_vectors",
  "contract_id": "PFWM1",
  "vectors": [
    {
      "id": "canonical",
      "hex": "5046574D31000000010000000002000110000100FFFF0F000100000000000000030000000200000000020000000000000005000000000000200500000000000000000004000000000100000050000100E0930400E09304002F96A9A4B403F0B99CD3AE8F02EB120A7A6039435D5509BDEC8BB5FF5A676E23645544DD203414BB44FD68B911ED11A2CD9C3FF3EB2512013DD07C57083C3BA7CB6FD52C958A740C289C79720E4988B7F3969910D51C555BC7694CB5772C2ADA17AFF903026B71FEB18534A13AF56128368D94827F0B863082364EAA7642382405364A9C7D972A4D46BC67BA02803F88E6CD64A48412BB69D2B900865D079C3984C7F3A47090C13E807AA2E67AB0657A33981620F3410A17EAE6F419AF3B343AFFB64978BF6C7F2E591EF9A258922D96A8B6DEBBFD555A9CAB9AECD2187872A7D49A2EE57B2DCBCB56B81826BB5E28435F185E392FD9A2DBDF7D0DB7D703221059E6AED1165A193CE5169ADCCE0CD3997C841AA4F4E7899C15AC3EC72946019FF6C9F418ED22E7FCFC20FDB9ED71CE52462D087123F402C6E2D9A4A66347D4515046574D312D4359434C453131322D53594E544845544943000000000000000000000000000000000000000000000000000000000000000000000000000000000000000000000000000000000000000000000000000000000000000000000000000000000000000064000000010001000000000000000000FFFF070000000000C482EEB10D3DDB1752BB1451AEF9F64C6400000000000000010012F100000000020012F100000000010012F100000000010012F100000000010012F1000000006410000000000000625B53C26F20EB487B50026DF8751BF458D08E824BD8464BAF42928B385444F320894D5FFCBEE94C791DFCD837809FA256F7B61EB100C3F3062CE7BEDB72581D269C89708D0AFC2F37464FC7E5D400B7D3EF828460047405A4F68E25FF6AFFB31F4858AF9AE084EAC6CC25BE09D54278A665EFF86E4830A95CD801710A1753C50B6FB3A0F9F80765F50661BD94DC4A8AEB708EB6CD5B273E0D924106E5654D2CC8000000020002000100010000000000FFFF070000000000A545D0BE7C219E6D88D63392D74E66ABC800000000000000011012F100000000021012F100000000011012F100000000011012F100000000011012F100000000C8100000000000000AE4931B27B93680ED9C2E69DF212A9AD8DE801051B105FE8F788305D94D047C278D88A24B7A86E9EB2A545B4A6E21ED75CFDF28E0DFC21CDE56EEDB8ABB8DBC760D84632701182C97F761B45FF4936EE5DADCDA99DB43C7F99B7C67BF842CF426FF169CFB3AE2F55E5738E56F18C60BC0C474C923C38E1C8EBC2B25FA4ED132F74650C4398E267C971098BF764F71A6493D07A608D5D5874AB134DBABEA187D2C010000030003000200010001000000FFFF07000000000028C1419CF19C87164082BCD7F593FE392C01000000000000012012F100000000022012F100000000012012F100000000012012F100000000012012F1000000002C11000000000000E0CE220701FD81EBC5628402823150CE3068CE5E73BA649FD2A4D7FB68B218F3286241D89BE776DC08332B645FA22D1342BCC458D984C9FE30C1DEC1C0DD8A225A498E85E439B15964079E0766B3760B75BE0D6B10FCF3F373F69475F072EF659BCAEA3040B9940FF827CD1357E1CEF9ABA0ABB790E5EFF6B3E7D620633FE932B215FEFA8705F3BEDD017A28BB2F63DEE30BB7F816061973832FF96C792074BEC800000064000000020012F1000000002C010000C8000000021012F100000000",
      "sha256": "0057FAC6ACBEE3E1BE3A71BB20CF26155DA343010380D07631328D640F4090A5",
      "summary": {
        "contract_id": "PFWM1",
        "version": "1.0",
        "manifest_id": "PFWM1-CYCLE112-SYNTHETIC",
        "manifest_version": 1,
        "profile": "synthetic_qualification",
        "file_bytes": 1312,
        "component_count": 3,
        "dependency_count": 2,
        "external_payload_bytes": 12888,
        "maximum_transaction_components": 1,
        "body_sha256": "F6C9F418ED22E7FCFC20FDB9ED71CE52462D087123F402C6E2D9A4A66347D451",
        "file_sha256": "0057FAC6ACBEE3E1BE3A71BB20CF26155DA343010380D07631328D640F4090A5"
      }
    },
    {
      "id": "minimal",
      "hex": "5046574D31000000010000000002000110000100FFFF0F000100000000000000010000000000000000020000000000000003000000000000000300000000000000000004000000000100000050000100E0930400E09304002F96A9A4B403F0B99CD3AE8F02EB120A7A6039435D5509BDEC8BB5FF5A676E23645544DD203414BB44FD68B911ED11A2CD9C3FF3EB2512013DD07C57083C3BA7CB6FD52C958A740C289C79720E4988B7F3969910D51C555BC7694CB5772C2ADA17AFF903026B71FEB18534A13AF56128368D94827F0B863082364EAA7642382405364A9C7D972A4D46BC67BA02803F88E6CD64A48412BB69D2B900865D079C3984C7F3A47090C13E807AA2E67AB0657A33981620F3410A17EAE6F419AF3B343AFFB64978BF6C7F2E591EF9A258922D96A8B6DEBBFD555A9CAB9AECD2187872A7D49A2EE57B2DCBCB56B81826BB5E28435F185E392FD9A2DBDF7D0DB7D703221059E6AED1165A193CE5169ADCCE0CD3997C841AA4F4E7899C15AC3EC72946019FAF4CD1D60DF78CA31ABD0F3F3DB2B16462A35B1282763C589115B5562FA4C4735046574D312D4D494E494D414C2D53594E54484554494300000000000000000000000000000000000000000000000000000000000000000000000000000000000000000000000000000000000000000000000000000000000000000000000000000000000000000001000000010001000000000000000000FFFF070000000000D6C0A07992FA7B4FD95A861A16AF684D0100000000000000013012F100000000023012F100000000013012F100000000013012F100000000013012F1000000000110000000000000E8F6885D55CC757B180019EDB4376F60ED80EF6E4F5209530602BFEA880D3B5F26C3C521E3A18BDAE2A80271F22C269507776277B3BCF0A9AA243AE2BC57CAE2212D11B6C9178DC3170A960D761C15A732E43523DC8F4607A25BFF16F160A9D34C0E6C5A7D172A9538DF8644DB3C0A8A8A473608E47F048EB8FDEFD015D377F964545F9E0E6D392235C41A5DD7797D37675E5FFF51EBDD348CA9BB31BD1E990F",
      "sha256": "AE419A80CBAC55169600B35168C60C7F1D20040570E2939B7BB2F7AE4E1A8EB2",
      "summary": {
        "contract_id": "PFWM1",
        "version": "1.0",
        "manifest_id": "PFWM1-MINIMAL-SYNTHETIC",
        "manifest_version": 1,
        "profile": "synthetic_qualification",
        "file_bytes": 768,
        "component_count": 1,
        "dependency_count": 0,
        "external_payload_bytes": 4097,
        "maximum_transaction_components": 1,
        "body_sha256": "AF4CD1D60DF78CA31ABD0F3F3DB2B16462A35B1282763C589115B5562FA4C473",
        "file_sha256": "AE419A80CBAC55169600B35168C60C7F1D20040570E2939B7BB2F7AE4E1A8EB2"
      }
    },
    {
      "id": "boundary",